<?xml version="1.0" encoding="UTF-8"?>
<!--
Licensed to the Apache Software Foundation (ASF) under one
or more contributor license agreements.  See the NOTICE file
distributed with this work for additional information
regarding copyright ownership.  The ASF licenses this file
to you under the Apache License, Version 2.0 (the
"License"); you may not use this file except in compliance
with the License.  You may obtain a copy of the License at

http://www.apache.org/licenses/LICENSE-2.0

Unless required by applicable law or agreed to in writing,
software distributed under the License is distributed on an
"AS IS" BASIS, WITHOUT WARRANTIES OR CONDITIONS OF ANY
KIND, either express or implied.  See the License for the
specific language governing permissions and limitations
under the License.
-->
<!--
Changes to this file: Copyright (C) Ilscipio GmbH. The changes are licensed
under the GNU Affero General Public License, version 3, or a commercial
license from Ilscipio GmbH (file LICENSE). The original code stays under
the Apache License, version 2.0, as stated above.
-->
<xs:schema xmlns:xs="http://www.w3.org/2001/XMLSchema" elementFormDefault="qualified">
    <xs:import namespace="http://www.w3.org/XML/1998/namespace" schemaLocation="http://www.w3.org/2001/xml.xsd" />

    <xs:complexType name="valueType">
        <xs:simpleContent>
            <xs:extension base="xs:string">
                <xs:attribute ref="xml:lang" use="required" />
                <xs:attribute ref="xml:space" />
            </xs:extension>
        </xs:simpleContent>
    </xs:complexType>

    <xs:element name="resource">
        <xs:complexType>
            <xs:sequence>
                <xs:element minOccurs="0" maxOccurs="unbounded" ref="property" />
            </xs:sequence>
            <xs:attribute name="global">
                <xs:annotation>
                    <xs:documentation>
                        If not specified, all label files named "*Labels.xml" are automatically included in global property-maps.
                        If set to false, prevents inclusion.
                        Labels from hot-deploy components automatically override those from framework and applications components
                        when combined in the global property-maps.
                        SCIPIO: 2.1.0: Added for global property-map support.
                    </xs:documentation>
                </xs:annotation>
                <xs:simpleType>
                    <xs:restriction base="xs:token">
                        <xs:enumeration value="true"/>
                        <xs:enumeration value="false"/>
                    </xs:restriction>
                </xs:simpleType>
            </xs:attribute>
        </xs:complexType>
    </xs:element>

    <xs:element name="property">
        <xs:complexType>
            <xs:sequence>
                <xs:element minOccurs="1" maxOccurs="unbounded" name="value" type="valueType" />
            </xs:sequence>
            <xs:attribute type="xs:string" name="key" use="required" />
        </xs:complexType>
    </xs:element>
</xs:schema>
